{
  "id": "8e4fa6d5-d397-496e-bb7e-09f529af10a5",
  "uuid": "8e4fa6d5-d397-496e-bb7e-09f529af10a5",
  "name": "01 - Begriffe und Konzepte",
  "handle": "18452/20731",
  "metadata": {
    "dc.identifier.uri": [
      {
        "value": "https://edoc.hu-berlin.de/18452/20731",
        "language": null,
        "authority": null,
        "confidence": -1,
        "place": 0
      }
    ],
    "dc.title": [
      {
        "value": "01 - Begriffe und Konzepte",
        "language": null,
        "authority": null,
        "confidence": -1,
        "place": 0
      }
    ]
  },
  "archivedItemsCount": -1,
  "type": "collection",
  "_links": {
    "logo": { "href": "https://edoc.hu-berlin.de/server/api/core/collections/8e4fa6d5-d397-496e-bb7e-09f529af10a5/logo" },
    "parentCommunity": { "href": "https://edoc.hu-berlin.de/server/api/core/collections/8e4fa6d5-d397-496e-bb7e-09f529af10a5/parentCommunity" },
    "self": { "href": "https://edoc.hu-berlin.de/server/api/core/collections/8e4fa6d5-d397-496e-bb7e-09f529af10a5" }
  }
}
